"CMT/CAPT Science Assessment, 2015-16"
"State of Connecticut, Grade 8, High Needs (F/R, EL or SWD)"

"",,,,,,"Below Basic",,"Basic",,"Proficient",,"Goal",,"Advanced",,"At or Above Goal",,""
"District","High Needs (F/R, EL or SWD)","Total Numberof Students","Total NumberTested","ParticipationRate","Total Number with Scored Tests","Count","%","Count","%","Count","%","Count","%","Count","%","Count","%","AverageSS"
"State of Connecticut","N",22232,22114,99.5,22113,547,2.5,913,4.1,2693,12.2,12051,54.5,5909,26.7,17960,81.2,276
"State of Connecticut","Y",17894,17591,98.3,17587,5387,30.6,2641,15.0,3624,20.6,5138,29.2,797,4.5,5935,33.7,227

