"CMT/CAPT Science Assessment, 2015-16"
"State of Connecticut, Grade 10, Free/Reduced Price Meal Eligibility (2-level)"

"",,,,,,"Below Basic",,"Basic",,"Proficient",,"Goal",,"Advanced",,"At or Above Goal",,""
"District","Free/Reduced Price Meal Eligibility (2-level)","Total Numberof Students","Total NumberTested","ParticipationRate","Total Number with Scored Tests","Count","%","Count","%","Count","%","Count","%","Count","%","Count","%","AverageSS"
"State of Connecticut","N",26682,26120,97.9,26060,1200,4.6,1868,7.2,7112,27.3,6280,24.1,9600,36.8,15880,60.9,276
"State of Connecticut","Y",14713,13709,93.2,13547,3306,24.4,2925,21.6,4473,33.0,1659,12.2,1184,8.7,2843,21.0,225

