"CMT/CAPT Science Assessment, 2015-16"
"State of Connecticut, Grade 5, High Needs (F/R, EL or SWD)"

"",,,,,,"Below Basic",,"Basic",,"Proficient",,"Goal",,"Advanced",,"At or Above Goal",,""
"District","High Needs (F/R, EL or SWD)","Total Numberof Students","Total NumberTested","ParticipationRate","Total Number with Scored Tests","Count","%","Count","%","Count","%","Count","%","Count","%","Count","%","AverageSS"
"State of Connecticut","N",20857,20781,99.6,20781,218,1.0,730,3.5,2717,13.1,10313,49.6,6803,32.7,17116,82.4,282
"State of Connecticut","Y",18494,18329,99.1,18327,3568,19.5,3821,20.8,4747,25.9,5051,27.6,1140,6.2,6191,33.8,227

