"CMT/CAPT Science Assessment, 2015-16"
"State of Connecticut, Grade 8, English Learner Status (EL)"

"",,,,,,"Below Basic",,"Basic",,"Proficient",,"Goal",,"Advanced",,"At or Above Goal",,""
"District","English Learner Status (EL)","Total Numberof Students","Total NumberTested","ParticipationRate","Total Number with Scored Tests","Count","%","Count","%","Count","%","Count","%","Count","%","Count","%","AverageSS"
"State of Connecticut","N",38270,37897,99.0,37894,4632,12.2,3311,8.7,6133,16.2,17116,45.2,6702,17.7,23818,62.9,257
"State of Connecticut","Y",1789,1767,98.8,1765,1270,72.0,238,13.5,181,10.3,"*","*","*","*",76,4.3,189

