"CMT/CAPT Science Assessment, 2015-16"
"State of Connecticut, Grade 10, English Learner Status (EL)"

"",,,,,,"Below Basic",,"Basic",,"Proficient",,"Goal",,"Advanced",,"At or Above Goal",,""
"District","English Learner Status (EL)","Total Numberof Students","Total NumberTested","ParticipationRate","Total Number with Scored Tests","Count","%","Count","%","Count","%","Count","%","Count","%","Count","%","AverageSS"
"State of Connecticut","N",39264,37953,96.7,37766,3355,8.9,4338,11.5,11386,30.1,7913,21.0,10774,28.5,18687,49.5,263
"State of Connecticut","Y",2021,1852,91.6,1818,1138,62.6,448,24.6,196,10.8,26,1.4,10,0.6,36,2.0,184

