"Smarter Balanced Growth Report, 2015-16"
"State of Connecticut, Free/Reduced Price Meal Eligibility (3-level)"

"District Code","District","Subject","Free/Reduced Price Meal Eligibility (3-level)","Number ofMatched Students","Growth Rate","Average Percentageof Target Achieved"
"=""0000000""","State of Connecticut","ELA","Eligible for Reduced Lunch",9077,"39.3%","61.3%"
"=""0000000""","State of Connecticut","ELA","Eligible for Free Lunch",62277,"34.6%","57.8%"
"=""0000000""","State of Connecticut","ELA","Not Eligible for Free/Reduced Lunch",113991,"48.1%","67.2%"
"=""0000000""","State of Connecticut","Math","Eligible for Reduced Lunch",9094,"39.6%","61.5%"
"=""0000000""","State of Connecticut","Math","Eligible for Free Lunch",62813,"34.7%","56.5%"
"=""0000000""","State of Connecticut","Math","Not Eligible for Free/Reduced Lunch",113957,"49.2%","69.9%"

