"Smarter Balanced Growth Report, 2015-16"
"State of Connecticut, Free/Reduced Price Meal Eligibility (3-level)"

"District Code","District","Free/Reduced Price Meal Eligibility (3-level)","Number ofMatched Students","Growth Rate","Average Percentageof Target Achieved"
"=""0000000""","State of Connecticut","Eligible for Reduced Lunch",9094,"39.6%","61.5%"
"=""0000000""","State of Connecticut","Eligible for Free Lunch",62813,"34.7%","56.5%"
"=""0000000""","State of Connecticut","Not Eligible for Free/Reduced Lunch",113957,"49.2%","69.9%"

