"Smarter Balanced Growth Report, 2015-16"
"State of Connecticut, Race"

"District Code","District","Race/Ethnicity","Number ofMatched Students","Growth Rate","Average Percentageof Target Achieved"
"=""0000000""","State of Connecticut","Native Hawaiian or Other Pacific Islander",155,"51.6%","68.1%"
"=""0000000""","State of Connecticut","American Indian or Alaska Native",478,"40.6%","63.9%"
"=""0000000""","State of Connecticut","Two or More Races",4876,"44.6%","64.2%"
"=""0000000""","State of Connecticut","Asian",9195,"55.0%","73.5%"
"=""0000000""","State of Connecticut","Black or African American",23011,"33.6%","56.6%"
"=""0000000""","State of Connecticut","Hispanic/Latino of any race",40951,"35.8%","58.8%"
"=""0000000""","State of Connecticut","White",106679,"46.9%","66.4%"

