"Five-Year Graduation Rates, 2012-13"
"State of Connecticut, Free/Reduced Price Meal Eligibility"

"",,,"Graduates",,"Non-Graduates",,,
"District","Free/Reduced Price Meal Eligibility","Five-Year Cohort Count","Graduation Count","Graduation Rate","Still Enrolled Count","Still Enrolled Rate","Other Count","Other Rate"
"State of Connecticut","Eligible For Free Lunch",12389,9082,73.3,434,3.5,2869,23.2
"State of Connecticut","Eligible For Reduced Lunch",3573,3131,87.6,83,2.3,359,10.0
"State of Connecticut","Not Eligible For Lunch",27486,25998,94.6,499,1.8,984,3.6

